{"$schema":"https://json-schema.org/draft/2020-12/schema","$id":"https://gist.local/contracts/registry/v1/provider.schema.json","type":"object","additionalProperties":false,"required":["id","support_state","last_verified_at"],"properties":{"id":{"type":"string"},"support_state":{"enum":["planned","catalog_only","resolvable","executable","degraded","retired"]},"last_verified_at":{"type":"string","format":"date-time"},"degraded_reason":{"type":"string"},"capture":{"type":"object","additionalProperties":false,"required":["source","digest"],"properties":{"source":{"type":"string"},"digest":{"$ref":"https://gist.local/contracts/registry/v1/common.schema.json#/$defs/digest"}}}}}
