[{"id":"composio","support_state":"catalog_only","last_verified_at":"2026-09-25T00:00:00Z","capture":{"source":"https://docs.composio.dev/docs/intro (404 on 2026-09-25; selection record retained)","digest":{"algorithm":"sha256","value":"16283d6a347481623de9bd6d9f1326052a4fe565f24dd555f6cdb0e5e474030e"}}},{"id":"github-mcp-server","support_state":"catalog_only","last_verified_at":"2026-09-25T00:00:00Z","capture":{"source":"https://github.com/github/github-mcp-server/raw/main/README.md","digest":{"algorithm":"sha256","value":"c5dd75e20548ea30157d4cabf1e395195879dfe6c4a89fc5df726e08d2230185"}}},{"id":"slack-web-api","support_state":"catalog_only","last_verified_at":"2026-09-25T00:00:00Z","capture":{"source":"https://api.slack.com/web","digest":{"algorithm":"sha256","value":"ab129311a702d181ead4ac7bf3e499c812952986f8e9560f5ac69161cab23a83"}}}]
